Type,Title,Headline 
infectivity,Spread of Delta variant driven by both immune escape and increased infectivity,Findings suggest infection control measures against variants will need to continue in the post vaccination era 
infectivity,A Snapshot Of SARS CoV 2 Evolution: Observed Increase Of Infectivity In The Covid 19 Virus,A recent scientific report underscores how rapidly SARS CoV   adapts to selective pressure The experiments examine how rapidly the virus can adapt to life in a Petri dish 
infectivity,Covid 19: Malaysia抯 infectivity rate below 1 0 for two days in a row,KUALA LUMPUR  Malaysia s Covid    infectivity rate or R   R naught  has come down to below     for two days straight with a reading of      on Friday  Sept    Read full story
infectivity,[ASAP] Implications of the Coffee Ring Effect on Virus Infectivity,The factors contributing to the survival of enveloped viruses  e g influenza and SARS CoV    on fomite surfaces are of societal interest The bacteriophage Phi  is an enveloped viral surrogate commonly used to study viability To investigate how viability c 
infectivity,Study Shows Vaccine Will Enhance Delta Infectivity,COVID    jabs continue to be pushed as the only solution to the pandemic even as  breakthrough  infections increasingly occur A group of Japanese researchers has also released research showing that the SARS CoV   Delta variant  is poised to acquire complete 
infectivity,Study: COVID Shot Enhances Delta Infectivity,The official COVID    vaccine narrative changes rapidly these days It took just one month for it to go from  if you re vaccinated you re not going to get COVID    including the Delta variant   to  people who got vaccinated early are at increased risk for sev 
infectivity,Spread of Delta driven by combination of immune escape increased infectivity: Nature The Tribune India, ol  li Spread of Delta driven by combination of immune escape increased infectivity  Nature  The Tribune India    li  li Explained  How Covid    vaccines fare with Delta variant  The Indian Express    li  li The Delta difference  Mint    li  li Do vaccines  
infectivity,SARS CoV 2 delta variant has higher viral RNA levels and increased infectivity suggests study News Medical Net, ol  li SARS CoV   delta variant has higher viral RNA levels and increased infectivity suggests study  News Medical Net    li  li Delta Overwhelming Other Covid Variants Of Concern  WHO  NDTV    li  li Coronavirus  Is the Delta variant making it difficult fo 
infectivity,Covid Shot Enhances Delta Infectivity,The official COVID    vaccine narrative changes rapidly these days It took just one month for it to go from  if you re vaccinated you re not going to get COVID    including the Delta variant   to  people who got vaccinated early are at increased risk for sev 
infectivity,COVID 19 virus rapidly evolves to higher infectivity during in vitro growth which may be a step toward lower virulence,Attenuated viral vaccines for rubella measles yellow fever and other diseases are widely used Can a similar vaccine be developed for COVID    Researchers have now published a foundational study for that possibility They asked a simple question  Which mut 
infectivity,Spread of Delta SARS CoV 2 variant driven by combination of immune escape and increased infectivity,The Delta variant of SARS CoV   which has become the dominant variant in countries including India and the UK has most likely spread through its ability to evade neutralising antibodies and its increased infectivity say an international team of researchers 
infectivity,Study Shows Vaccine Will ENHANCE Delta Infectivity,Study Shows Vaccine Will ENHANCE Delta InfectivitySTORY AT A GLANCEA group of Japanese researchers released research showing that the SARS CoV   Delta variant  is poised to acquire complete resistance  to existing COVID    jabs When four common mutations were 
infectivity,Study Shows Vaccine Will ENHANCE Delta Infectivity,Study Shows Vaccine Will ENHANCE Delta InfectivitySTORY AT A GLANCEA group of Japanese researchers released research showing that the SARS CoV   Delta variant  is poised to acquire complete resistance  to existing COVID    jabs When four common mutations were 
infectivity,Increased infectivity ability to escape immunity drove Delta variant: Study,The B         or Delta variant was first observed in India in late      It has since spread around the globe 
infectivity,Health DG: Covid 19 infectivity rate now down to 0 99 from 1 17 in January,PETALING JAYA  Malaysia s Covid    infectivity rate   known as R   pronounced R naught    has come down to      says Health director general Tan Sri Dr Noor Hisham Abdullah Read full story
infectivity,Covid 19: 28 new clusters recorded infectivity rate now at 0 99,PETALING JAYA  Malaysia recorded    new Covid    clusters on Saturday taking the current number of active ones in the country to       Read full story
infectivity,Study Shows Vaccine Will Enhance Delta Infectivity,Japanese researchers have submitted a new study showing that mRNA vaccines may actually enhance the infectivity of the Delta variant making it completely resistant to the vaccine  While the vaccines have shown to be effective against certain variants of conc 
